{
  "benchmark_id": "tau2-airline",
  "name": "Tau2 airline",
  "parent_benchmark_id": null,
  "category": "general",
  "modality": "text",
  "multilingual": false,
  "max_score": 1.0,
  "language": "en",
  "description": "Tau2 airline benchmark",
  "paper_link": null,
  "implementation_link": null,
  "verified": false,
  "created_at": "2025-07-19T19:56:12.396617+00:00",
  "updated_at": "2025-07-19T19:56:12.396617+00:00"
}