{
  "benchmark_id": "spider",
  "name": "Spider",
  "parent_benchmark_id": null,
  "category": "code",
  "modality": "text",
  "multilingual": false,
  "max_score": 1.0,
  "language": "en",
  "description": "Spider benchmark",
  "paper_link": null,
  "implementation_link": null,
  "verified": false,
  "created_at": "2025-07-19T19:56:15.156791+00:00",
  "updated_at": "2025-07-19T19:56:15.156791+00:00"
}