{
  "benchmark_id": "swe-bench-verified-(agentless)",
  "name": "SWE-bench Verified (Agentless)",
  "parent_benchmark_id": null,
  "category": "agents",
  "modality": "text",
  "multilingual": false,
  "max_score": 1.0,
  "language": "en",
  "description": "SWE-bench Verified (Agentless) benchmark",
  "paper_link": null,
  "implementation_link": null,
  "verified": false,
  "created_at": "2025-07-19T19:56:12.328122+00:00",
  "updated_at": "2025-07-19T19:56:12.328122+00:00"
}