{
  "benchmark_id": "vibe-eval",
  "name": "Vibe-Eval",
  "parent_benchmark_id": null,
  "category": "code",
  "modality": "text",
  "multilingual": false,
  "max_score": 1.0,
  "language": "en",
  "description": "Vibe-Eval benchmark",
  "paper_link": null,
  "implementation_link": null,
  "verified": false,
  "created_at": "2025-07-19T19:56:13.871369+00:00",
  "updated_at": "2025-07-19T19:56:13.871369+00:00"
}