{
  "benchmark_id": "scienceqa-visual",
  "name": "ScienceQA Visual",
  "parent_benchmark_id": null,
  "category": "vision",
  "modality": "multimodal",
  "multilingual": false,
  "max_score": 1.0,
  "language": "en",
  "description": "ScienceQA Visual benchmark",
  "paper_link": null,
  "implementation_link": null,
  "verified": false,
  "created_at": "2025-07-19T19:56:14.300722+00:00",
  "updated_at": "2025-07-19T19:56:14.300722+00:00"
}