{
  "benchmark_id": "vqav2-(test)",
  "name": "VQAv2 (test)",
  "parent_benchmark_id": null,
  "category": "vision",
  "modality": "multimodal",
  "multilingual": false,
  "max_score": 1.0,
  "language": "en",
  "description": "VQAv2 (test) benchmark",
  "paper_link": null,
  "implementation_link": null,
  "verified": false,
  "created_at": "2025-07-19T19:56:14.430940+00:00",
  "updated_at": "2025-07-19T19:56:14.430940+00:00"
}