{
  "benchmark_id": "truthfulqa",
  "name": "TruthfulQA",
  "parent_benchmark_id": null,
  "category": "factuality",
  "modality": "text",
  "multilingual": false,
  "max_score": 1.0,
  "language": "en",
  "description": "TruthfulQA benchmark",
  "paper_link": null,
  "implementation_link": null,
  "verified": false,
  "created_at": "2025-07-19T19:56:11.339268+00:00",
  "updated_at": "2025-07-19T19:56:11.339268+00:00"
}