{
  "benchmark_id": "visualwebbench",
  "name": "VisualWebBench",
  "parent_benchmark_id": null,
  "category": "vision",
  "modality": "multimodal",
  "multilingual": false,
  "max_score": 1.0,
  "language": "en",
  "description": "VisualWebBench benchmark",
  "paper_link": null,
  "implementation_link": null,
  "verified": false,
  "created_at": "2025-07-19T19:56:12.747583+00:00",
  "updated_at": "2025-07-19T19:56:12.747583+00:00"
}