{
  "benchmark_id": "voicebench-avg",
  "name": "VoiceBench Avg",
  "parent_benchmark_id": null,
  "category": "general",
  "modality": "audio",
  "multilingual": false,
  "max_score": 1.0,
  "language": "en",
  "description": "VoiceBench Avg benchmark",
  "paper_link": null,
  "implementation_link": null,
  "verified": false,
  "created_at": "2025-07-19T19:56:14.922519+00:00",
  "updated_at": "2025-07-19T19:56:14.922519+00:00"
}