{
  "benchmark_id": "sat-math",
  "name": "SAT Math",
  "parent_benchmark_id": null,
  "category": "math",
  "modality": "text",
  "multilingual": false,
  "max_score": 1.0,
  "language": "en",
  "description": "SAT Math benchmark",
  "paper_link": null,
  "implementation_link": null,
  "verified": false,
  "created_at": "2025-07-19T19:56:15.414463+00:00",
  "updated_at": "2025-07-19T19:56:15.414463+00:00"
}