{
  "benchmark_id": "zebralogic",
  "name": "ZebraLogic",
  "parent_benchmark_id": null,
  "category": "reasoning",
  "modality": "text",
  "multilingual": false,
  "max_score": 1.0,
  "language": "en",
  "description": "ZebraLogic benchmark",
  "paper_link": null,
  "implementation_link": null,
  "verified": false,
  "created_at": "2025-07-19T19:56:12.500425+00:00",
  "updated_at": "2025-07-19T19:56:12.500425+00:00"
}