{
  "benchmark_id": "stem",
  "name": "STEM",
  "parent_benchmark_id": null,
  "category": "general",
  "modality": "text",
  "multilingual": false,
  "max_score": 1.0,
  "language": "en",
  "description": "STEM benchmark",
  "paper_link": null,
  "implementation_link": null,
  "verified": false,
  "created_at": "2025-07-19T19:56:14.559354+00:00",
  "updated_at": "2025-07-19T19:56:14.559354+00:00"
}