{
  "benchmark_id": "translation-en\u2192set1-comet22",
  "name": "Translation en\u2192Set1 COMET22",
  "parent_benchmark_id": null,
  "category": "general",
  "modality": "text",
  "multilingual": false,
  "max_score": 1.0,
  "language": "en",
  "description": "Translation en\u2192Set1 COMET22 benchmark",
  "paper_link": null,
  "implementation_link": null,
  "verified": false,
  "created_at": "2025-07-19T19:56:12.959436+00:00",
  "updated_at": "2025-07-19T19:56:12.959436+00:00"
}