{
  "benchmark_id": "translation-set1\u2192en-spbleu",
  "name": "Translation Set1\u2192en spBleu",
  "parent_benchmark_id": null,
  "category": "general",
  "modality": "text",
  "multilingual": false,
  "max_score": 1.0,
  "language": "en",
  "description": "Translation Set1\u2192en spBleu benchmark",
  "paper_link": null,
  "implementation_link": null,
  "verified": false,
  "created_at": "2025-07-19T19:56:12.967240+00:00",
  "updated_at": "2025-07-19T19:56:12.967240+00:00"
}