{
  "benchmark_id": "vatex",
  "name": "VATEX",
  "parent_benchmark_id": null,
  "category": "general",
  "modality": "text",
  "multilingual": false,
  "max_score": 1.0,
  "language": "en",
  "description": "VATEX benchmark",
  "paper_link": null,
  "implementation_link": null,
  "verified": false,
  "created_at": "2025-07-19T19:56:12.909879+00:00",
  "updated_at": "2025-07-19T19:56:12.909879+00:00"
}