{
  "benchmark_id": "tau-bench",
  "name": "Tau-bench",
  "parent_benchmark_id": null,
  "category": "agents",
  "modality": "text",
  "multilingual": false,
  "max_score": 1.0,
  "language": "en",
  "description": "Tau-bench benchmark",
  "paper_link": null,
  "implementation_link": null,
  "verified": false,
  "created_at": "2025-07-19T19:56:15.219001+00:00",
  "updated_at": "2025-07-19T19:56:15.219001+00:00"
}