{
  "benchmark_id": "wild-bench",
  "name": "Wild Bench",
  "parent_benchmark_id": null,
  "category": "general",
  "modality": "text",
  "multilingual": false,
  "max_score": 1.0,
  "language": "en",
  "description": "Wild Bench benchmark",
  "paper_link": null,
  "implementation_link": null,
  "verified": false,
  "created_at": "2025-07-19T19:56:15.122112+00:00",
  "updated_at": "2025-07-19T19:56:15.122112+00:00"
}