{
  "benchmark_id": "vqav2-(val)",
  "name": "VQAv2 (val)",
  "parent_benchmark_id": null,
  "category": "vision",
  "modality": "multimodal",
  "multilingual": false,
  "max_score": 1.0,
  "language": "en",
  "description": "VQAv2 (val) benchmark",
  "paper_link": null,
  "implementation_link": null,
  "verified": false,
  "created_at": "2025-07-19T19:56:13.647852+00:00",
  "updated_at": "2025-07-19T19:56:13.647852+00:00"
}