{
  "benchmark_id": "swe-bench-verified-(multiple-attempts)",
  "name": "SWE-bench Verified (Multiple Attempts)",
  "parent_benchmark_id": null,
  "category": "general",
  "modality": "text",
  "multilingual": false,
  "max_score": 1.0,
  "language": "en",
  "description": "SWE-bench Verified (Multiple Attempts) benchmark",
  "paper_link": null,
  "implementation_link": null,
  "verified": false,
  "created_at": "2025-07-19T19:56:12.336780+00:00",
  "updated_at": "2025-07-19T19:56:12.336780+00:00"
}