{
  "benchmark_id": "video-mme-(long,-no-subtitles)",
  "name": "Video-MME (long, no subtitles)",
  "parent_benchmark_id": null,
  "category": "vision",
  "modality": "video",
  "multilingual": false,
  "max_score": 1.0,
  "language": "en",
  "description": "Video-MME (long, no subtitles) benchmark",
  "paper_link": null,
  "implementation_link": null,
  "verified": false,
  "created_at": "2025-07-19T19:56:15.374053+00:00",
  "updated_at": "2025-07-19T19:56:15.374053+00:00"
}